### ISSUE TITLE
http server response into mulitple packets

### ISSUE THREAD

**Issue by jims-1234** [yhirose/cpp-httplib#352]
Hi,

Just started playing with this a few hours ago, perhaps I've not configured something, or this is expected behavior. I have the example HTTP server running, and looking at tcpdump it produces quite a few more packets than I expected. Each HTTP response line is in its own packet.

tcpdump output:

> 08:33:28.618925 IP 127.0.0.1.8080 > 127.0.0.1.35324: Flags [P.], seq 1:18, ack 81, win 512, options [nop,nop,TS val 2823847013 ecr 2823847012], length 17: HTTP: HTTP/1.1 200 OK
	0x0000:  4500 0045 af58 4000 4006 8d58 7f00 0001  E..E.X@.@..X....
	0x0010:  7f00 0001 1f90 89fc a5ad 6c3a 527c 283c  ..........l:R|(<
	0x0020:  8018 0200 fe39 0000 0101 080a a850 7c65  .....9.......P|e
	0x0030:  a850 7c64 4854 5450 2f31 2e31 2032 3030  .P|dHTTP/1.1.200
	0x0040:  204f 4b0d 0a                             .OK..
> 08:33:28.618937 IP 127.0.0.1.35324 > 127.0.0.1.8080: Flags [.], ack 18, win 512, options [nop,nop,TS val 2823847013 ecr 2823847013], length 0
	0x0000:  4500 0034 1808 4000 4006 24ba 7f00 0001  E..4..@.@.$.....
	0x0010:  7f00 0001 89fc 1f90 527c 283c a5ad 6c4b  ........R|(<..lK
	0x0020:  8010 0200 fe28 0000 0101 080a a850 7c65  .....(.......P|e
	0x0030:  a850 7c65                                .P|e
> 08:33:28.618977 IP 127.0.0.1.8080 > 127.0.0.1.35324: Flags [P.], seq 18:38, ack 81, win 512, options [nop,nop,TS val 2823847013 ecr 2823847013], length 20: HTTP
	0x0000:  4500 0048 af59 4000 4006 8d54 7f00 0001  E..H.Y@.@..T....
	0x0010:  7f00 0001 1f90 89fc a5ad 6c4b 527c 283c  ..........lKR|(<
	0x0020:  8018 0200 fe3c 0000 0101 080a a850 7c65  .....<.......P|e
	0x0030:  a850 7c65 436f 6e74 656e 742d 4c65 6e67  .P|eContent-Leng
	0x0040:  7468 3a20 3339 0d0a                      th:.39..
> 08:33:28.618985 IP 127.0.0.1.35324 > 127.0.0.1.8080: Flags [.], ack 38, win 512, options [nop,nop,TS val 2823847013 ecr 2823847013], length 0
	0x0000:  4500 0034 1809 4000 4006 24b9 7f00 0001  E..4..@.@.$.....
	0x0010:  7f00 0001 89fc 1f90 527c 283c a5ad 6c5f  ........R|(<..l_
	0x0020:  8010 0200 fe28 0000 0101 080a a850 7c65  .....(.......P|e
	0x0030:  a850 7c65                                .P|e
> 08:33:28.618999 IP 127.0.0.1.8080 > 127.0.0.1.35324: Flags [P.], seq 38:64, ack 81, win 512, options [nop,nop,TS val 2823847013 ecr 2823847013], length 26: HTTP
	0x0000:  4500 004e af5a 4000 4006 8d4d 7f00 0001  E..N.Z@.@..M....
	0x0010:  7f00 0001 1f90 89fc a5ad 6c5f 527c 283c  ..........l_R|(<
	0x0020:  8018 0200 fe42 0000 0101 080a a850 7c65  .....B.......P|e
	0x0030:  a850 7c65 436f 6e74 656e 742d 5479 7065  .P|eContent-Type
	0x0040:  3a20 7465 7874 2f70 6c61 696e 0d0a       :.text/plain..
> 08:33:28.619004 IP 127.0.0.1.35324 > 127.0.0.1.8080: Flags [.], ack 64, win 512, options [nop,nop,TS val 2823847013 ecr 2823847013], length 0
	0x0000:  4500 0034 180a 4000 4006 24b8 7f00 0001  E..4..@.@.$.....
	0x0010:  7f00 0001 89fc 1f90 527c 283c a5ad 6c79  ........R|(<..ly
	0x0020:  8010 0200 fe28 0000 0101 080a a850 7c65  .....(.......P|e
	0x0030:  a850 7c65                                .P|e
> 08:33:28.619016 IP 127.0.0.1.8080 > 127.0.0.1.35324: Flags [P.], seq 64:77, ack 81, win 512, options [nop,nop,TS val 2823847013 ecr 2823847013], length 13: HTTP
	0x0000:  4500 0041 af5b 4000 4006 8d59 7f00 0001  E..A.[@.@..Y....
	0x0010:  7f00 0001 1f90 89fc a5ad 6c79 527c 283c  ..........lyR|(<
	0x0020:  8018 0200 fe35 0000 0101 080a a850 7c65  .....5.......P|e
	0x0030:  a850 7c65 5465 7374 3a20 7661 6c75 650d  .P|eTest:.value.
	0x0040:  0a                                       .
> 08:33:28.619021 IP 127.0.0.1.35324 > 127.0.0.1.8080: Flags [.], ack 77, win 512, options [nop,nop,TS val 2823847013 ecr 2823847013], length 0
	0x0000:  4500 0034 180b 4000 4006 24b7 7f00 0001  E..4..@.@.$.....
	0x0010:  7f00 0001 89fc 1f90 527c 283c a5ad 6c86  ........R|(<..l.
	0x0020:  8010 0200 fe28 0000 0101 080a a850 7c65  .....(.......P|e
	0x0030:  a850 7c65                                .P|e
> 08:33:28.619033 IP 127.0.0.1.8080 > 127.0.0.1.35324: Flags [P.], seq 77:79, ack 81, win 512, options [nop,nop,TS val 2823847013 ecr 2823847013], length 2: HTTP
	0x0000:  4500 0036 af5c 4000 4006 8d63 7f00 0001  E..6.\@.@..c....
	0x0010:  7f00 0001 1f90 89fc a5ad 6c86 527c 283c  ..........l.R|(<
	0x0020:  8018 0200 fe2a 0000 0101 080a a850 7c65  .....*.......P|e
	0x0030:  a850 7c65 0d0a                           .P|e..
> 08:33:28.619038 IP 127.0.0.1.35324 > 127.0.0.1.8080: Flags [.], ack 79, win 512, options [nop,nop,TS val 2823847013 ecr 2823847013], length 0
	0x0000:  4500 0034 180c 4000 4006 24b6 7f00 0001  E..4..@.@.$.....
	0x0010:  7f00 0001 89fc 1f90 527c 283c a5ad 6c88  ........R|(<..l.
	0x0020:  8010 0200 fe28 0000 0101 080a a850 7c65  .....(.......P|e
	0x0030:  a850 7c65                                .P|e
> 08:33:28.619118 IP 127.0.0.1.8080 > 127.0.0.1.35324: Flags [P.], seq 79:118, ack 81, win 512, options [nop,nop,TS val 2823847013 ecr 2823847013], length 39: HTTP
	0x0000:  4500 005b af5d 4000 4006 8d3d 7f00 0001  E..[.]@.@..=....
	0x0010:  7f00 0001 1f90 89fc a5ad 6c88 527c 283c  ..........l.R|(<
	0x0020:  8018 0200 fe4f 0000 0101 080a a850 7c65  .....O.......P|e
	0x0030:  a850 7c65 4865 6c6c 6f20 576f 726c 6421  .P|eHello.World!
	0x0040:  0a48 656c 6c6f 2057 6f72 6c64 210a 4865  .Hello.World!.He
	0x0050:  6c6c 6f20 576f 726c 6421 0a              llo.World!.

Note Content-Type, Test and Content-Length are in their own packets, and client has to perform a ACK before getting the next header line. I would think this will be major performance issue on higher latency networks.

Otherwise this appears to be a very good lightweight http server!

Cheers

James

**Comment by jims-1234** [comment]
I assume this may have something to do with TCP_NODELAY?

I turned it off explicitly with:

`svr.listen("localhost", 8080, !(TCP_NODELAY));`

but no change.

**Comment by PixlRainbow** [comment]
I suspect it's more to do with the fact that we flush after every line

**Comment by yhirose** [comment]
@jims-1234, could you try with the latest httplib.h to see if the problem is fixed? Thank you!

**Comment by jims-1234** [comment]
@yhirose looks good.. only one response packet for all the headers, and another for the payload..

be even better to combine the two, but this will go along way..

Thanks

**Comment by yhirose** [comment]
@jims-1234, thanks for checking. I intentionally separate the body from the response line and headers for now. If the body content size is fixed small size, we can include it in the same packet without requiring lots of memory. But if the response body is the chunked stream, we can't include it. Anyway, I'll think about it. Thank you!
